{
  "calculation_strategy": "lut",
  "created_at": "2025-04-28T23:34:57.359526",
  "measure_description": "Measured with utils/measure script",
  "measure_device": "Shelly Plus Plug S",
  "measure_method": "script",
  "measure_settings": {
    "SAMPLE_COUNT": 2,
    "SLEEP_TIME": 3,
    "VERSION": "v1.17.11:docker"
  },
  "name": "G95Gold",
  "standby_power": 0.61
}