{
  "calculation_strategy": "lut",
  "created_at": "2025-03-13T20:09:51.989491",
  "measure_description": "Measured with utils/measure script",
  "measure_device": "TP-Link Kasa HS110",
  "measure_method": "script",
  "measure_settings": {
    "SAMPLE_COUNT": 2,
    "SLEEP_TIME": 3,
    "VERSION": "v1.17.9:docker"
  },
  "name": "Hue Calla Large Outdoor Pedestal",
  "standby_power": 0.35
}
