{
  "calculation_strategy": "lut",
  "created_at": "2025-01-23T13:08:49.501748",
  "measure_description": "Measured with utils/measure script",
  "measure_device": "TP-Link HS110",
  "measure_method": "script",
  "measure_settings": {
    "SAMPLE_COUNT": 2,
    "SLEEP_TIME": 3,
    "VERSION": "v1.17.2:docker"
  },
  "name": "CK-BL702-AL-01",
  "standby_power": 0.44
}
