{
  "calculation_strategy": "lut",
  "created_at": "2024-11-15T11:59:34.923133",
  "measure_description": "Measured with utils/measure script",
  "measure_device": "TS011F",
  "measure_method": "script",
  "measure_settings": {
    "SAMPLE_COUNT": 2,
    "SLEEP_TIME": 3,
    "VERSION": "v1.15.4:docker"
  },
  "name": "50396",
  "standby_power": 0
}
