{
  "calculation_enabled_condition": "{{ is_state('[[entity]]', 'playing') }}",
  "calculation_strategy": "linear",
  "created_at": "2025-04-30T20:17:58.225009",
  "device_type": "smart_speaker",
  "linear_config": {
    "calibrate": [
      "10 -> 1.93",
      "20 -> 1.97",
      "30 -> 2.09",
      "40 -> 2.07",
      "50 -> 2.13",
      "60 -> 2.49",
      "70 -> 2.64",
      "80 -> 2.29",
      "90 -> 2.19",
      "100 -> 2.19",
      "0 -> 1.77"
    ]
  },
  "measure_description": "Measured with utils/measure script",
  "measure_device": "Shelly PM mini Gen3",
  "measure_method": "script",
  "measure_settings": {
    "SAMPLE_COUNT": 2,
    "SLEEP_TIME": 3,
    "VERSION": "v1.17.11:docker"
  },
  "name": "Amazon Alexa Echo Dot Gen 2",
  "standby_power": 1.8
}
