{
  "calculation_strategy": "lut",
  "created_at": "2025-04-15T02:02:58.771223",
  "measure_description": "Measured with utils/measure script",
  "measure_device": "Shelly PM mini Gen3",
  "measure_method": "script",
  "measure_settings": {
    "SAMPLE_COUNT": 2,
    "SLEEP_TIME": 3,
    "VERSION": "v1.17.10:docker"
  },
  "name": "Hue Argenta color spot",
  "standby_power": 0.4,
  "aliases": [
    "929003808201_01",
    "929003808201_02",
    "929003808201_03",
    "929003808201_04"
  ]
}
