{
  "calculation_strategy": "lut",
  "created_at": "2025-05-29T01:13:06.407596",
  "measure_description": "Measured with utils/measure script",
  "measure_device": "NOUS A1",
  "measure_method": "script",
  "measure_settings": {
    "SAMPLE_COUNT": 2,
    "SLEEP_TIME": 3,
    "VERSION": "v1.17.12:docker"
  },
  "name": "RB 249 T",
  "standby_power": 4.5
}
