{
  "calculation_strategy": "lut",
  "created_at": "2025-04-18T08:54:05.495469",
  "measure_description": "Measured with utils/measure script",
  "measure_device": "Shelly, 1PM Mini Gen 3",
  "measure_method": "script",
  "measure_settings": {
    "SAMPLE_COUNT": 2,
    "SLEEP_TIME": 3,
    "VERSION": "v1.17.10:docker"
  },
  "name": "Hue ambiance downlight (LDT001)",
  "standby_power": 0.45
}
